{
  "contract": "ideia.context-package/1",
  "context_package_id": "cxp_123e4567-e89b-42d3-a456-426614174000",
  "task_id": "tsk_123e4567-e89b-42d3-a456-426614174000",
  "step_id": "stp_123e4567-e89b-42d3-a456-426614174000",
  "criterion_id": "crt_123e4567-e89b-42d3-a456-426614174000",
  "governance_bundle_id": "default",
  "governance_bundle_fingerprint": "sha256:0000000000000000000000000000000000000000000000000000000000000000",
  "query_ids": [
    "cxq_123e4567-e89b-42d3-a456-426614174000"
  ],
  "items": [
    {
      "position": 0,
      "context_item_id": "cxi_123e4567-e89b-42d3-a456-426614174000",
      "item_fingerprint": "sha256:0000000000000000000000000000000000000000000000000000000000000000",
      "content_artifact_id": "art_123e4567-e89b-42d3-a456-426614174000",
      "content_ref": {
        "profile": "raw-sha256-v1",
        "digest": "sha256:0000000000000000000000000000000000000000000000000000000000000000",
        "size_bytes": 0,
        "media_type": "default"
      }
    }
  ],
  "total_bytes": 0,
  "estimated_tokens": 0,
  "data_classes": [
    "D0"
  ],
  "ordering_rule": "package-position-v1",
  "truncated": true,
  "exclusions": [
    {
      "reason_code": "default",
      "count": 1
    }
  ],
  "redaction_status": "not_required",
  "destination": "local",
  "endpoint_profile": "default",
  "created_at": "2024-01-01T00:00:00.000Z",
  "validated_at": "2024-01-01T00:00:00.000Z",
  "expires_at": "2024-01-01T00:00:00.000Z",
  "package_fingerprint": "sha256:0000000000000000000000000000000000000000000000000000000000000000"
}
